{
  "schema_version": 1,
  "listening_event_id": "33333333-3333-4333-8333-333333333333",
  "subject_id": "11111111-1111-4111-8111-111111111111",
  "track_ref_id": "22222222-2222-4222-8222-222222222222",
  "track_ref_revision": 1,
  "event_type": "play_observed",
  "occurred_at": "2026-08-23T09:10:00Z",
  "ingested_at": "2026-08-23T09:15:00Z",
  "interaction_mode": "active",
  "played_ms": 210000,
  "context": {
    "context_type": "playlist",
    "entity_ref": {
      "entity_type": "playlist",
      "entity_key": "playlist.synthetic_night",
      "label": "Synthetic Night Study"
    }
  },
  "provenance": {
    "source_kind": "import",
    "captured_at": "2026-08-23T09:15:00Z",
    "external_ref": {
      "system": "synthetic-stream",
      "entity_type": "event.listening",
      "external_id": "play-example-001"
    },
    "import_batch_id": "bbbbbbbb-bbbb-4bbb-8bbb-bbbbbbbbbbbb"
  },
  "deduplication_key": "synthetic-stream:play-example-001"
}
